{
  "version": "1.0",
  "kind": "tilemap_blueprint",
  "scene_id": "campus_gundam",
  "map_size": [
    16,
    16
  ],
  "tile_size": [
    64,
    64
  ],
  "layers": {
    "cells": [
      {
        "x": 0,
        "y": 0,
        "layer": "terrain",
        "material": "campus_lawn",
        "role": "center",
        "reuse": "variant_tile",
        "source_reason": "base_terrain fill"
      },
      {
        "x": 1,
        "y": 0,
        "layer": "terrain",
        "material": "campus_lawn",
        "role": "center",
        "reuse": "variant_tile",
        "source_reason": "base_terrain fill"
      },
      {
        "x": 2,
        "y": 0,
        "layer": "terrain",
        "material": "campus_lawn",
        "role": "center",
        "reuse": "variant_tile",
        "source_reason": "base_terrain fill"
      },
      {
        "x": 3,
        "y": 0,
        "layer": "terrain",
        "material": "campus_lawn",
        "role": "center",
        "reuse": "variant_tile",
        "source_reason": "base_terrain fill"
      },
      {
        "x": 4,
        "y": 0,
        "layer": "terrain",
        "material": "campus_lawn",
        "role": "center",
        "reuse": "variant_tile",
        "source_reason": "base_terrain fill"
      },
      {
        "x": 5,
        "y": 0,
        "layer": "terrain",
        "material": "campus_lawn",
        "role": "center",
        "reuse": "variant_tile",
        "source_reason": "base_terrain fill"
      },
      {
        "x": 6,
        "y": 0,
        "layer": "terrain",
        "material": "campus_lawn",
        "role": "center",
        "reuse": "variant_tile",
        "source_reason": "base_terrain fill"
      },
      {
        "x": 7,
        "y": 0,
        "layer": "terrain",
        "material": "campus_lawn",
        "role": "center",
        "reuse": "variant_tile",
        "source_reason": "base_terrain fill"
      },
      {
        "x": 8,
        "y": 0,
        "layer": "terrain",
        "material": "campus_lawn",
        "role": "center",
        "reuse": "variant_tile",
        "source_reason": "base_terrain fill"
      },
      {
        "x": 9,
        "y": 0,
        "layer": "terrain",
        "material": "campus_lawn",
        "role": "center",
        "reuse": "variant_tile",
        "source_reason": "base_terrain fill"
      },
      {
        "x": 10,
        "y": 0,
        "layer": "terrain",
        "material": "campus_lawn",
        "role": "center",
        "reuse": "variant_tile",
        "source_reason": "base_terrain fill"
      },
      {
        "x": 11,
        "y": 0,
        "layer": "terrain",
        "material": "campus_lawn",
        "role": "center",
        "reuse": "variant_tile",
        "source_reason": "base_terrain fill"
      },
      {
        "x": 12,
        "y": 0,
        "layer": "terrain",
        "material": "campus_lawn",
        "role": "center",
        "reuse": "variant_tile",
        "source_reason": "base_terrain fill"
      },
      {
        "x": 13,
        "y": 0,
        "layer": "terrain",
        "material": "campus_lawn",
        "role": "center",
        "reuse": "variant_tile",
        "source_reason": "base_terrain fill"
      },
      {
        "x": 14,
        "y": 0,
        "layer": "terrain",
        "material": "campus_lawn",
        "role": "center",
        "reuse": "variant_tile",
        "source_reason": "base_terrain fill"
      },
      {
        "x": 15,
        "y": 0,
        "layer": "terrain",
        "material": "campus_lawn",
        "role": "center",
        "reuse": "variant_tile",
        "source_reason": "base_terrain fill"
      },
      {
        "x": 0,
        "y": 1,
        "layer": "terrain",
        "material": "campus_lawn",
        "role": "center",
        "reuse": "variant_tile",
        "source_reason": "base_terrain fill"
      },
      {
        "x": 1,
        "y": 1,
        "layer": "terrain",
        "material": "campus_lawn",
        "role": "center",
        "reuse": "variant_tile",
        "source_reason": "base_terrain fill"
      },
      {
        "x": 2,
        "y": 1,
        "layer": "terrain",
        "material": "campus_lawn",
        "role": "center",
        "reuse": "variant_tile",
        "source_reason": "base_terrain fill"
      },
      {
        "x": 3,
        "y": 1,
        "layer": "terrain",
        "material": "campus_lawn",
        "role": "center",
        "reuse": "variant_tile",
        "source_reason": "base_terrain fill"
      },
      {
        "x": 4,
        "y": 1,
        "layer": "terrain",
        "material": "campus_lawn",
        "role": "center",
        "reuse": "variant_tile",
        "source_reason": "base_terrain fill"
      },
      {
        "x": 5,
        "y": 1,
        "layer": "terrain",
        "material": "campus_lawn",
        "role": "center",
        "reuse": "variant_tile",
        "source_reason": "base_terrain fill"
      },
      {
        "x": 6,
        "y": 1,
        "layer": "terrain",
        "material": "campus_lawn",
        "role": "center",
        "reuse": "variant_tile",
        "source_reason": "base_terrain fill"
      },
      {
        "x": 7,
        "y": 1,
        "layer": "terrain",
        "material": "campus_lawn",
        "role": "center",
        "reuse": "variant_tile",
        "source_reason": "base_terrain fill"
      },
      {
        "x": 8,
        "y": 1,
        "layer": "terrain",
        "material": "campus_lawn",
        "role": "center",
        "reuse": "variant_tile",
        "source_reason": "base_terrain fill"
      },
      {
        "x": 9,
        "y": 1,
        "layer": "terrain",
        "material": "campus_lawn",
        "role": "center",
        "reuse": "variant_tile",
        "source_reason": "base_terrain fill"
      },
      {
        "x": 10,
        "y": 1,
        "layer": "terrain",
        "material": "campus_lawn",
        "role": "center",
        "reuse": "variant_tile",
        "source_reason": "base_terrain fill"
      },
      {
        "x": 11,
        "y": 1,
        "layer": "terrain",
        "material": "campus_lawn",
        "role": "center",
        "reuse": "variant_tile",
        "source_reason": "base_terrain fill"
      },
      {
        "x": 12,
        "y": 1,
        "layer": "terrain",
        "material": "campus_lawn",
        "role": "center",
        "reuse": "variant_tile",
        "source_reason": "base_terrain fill"
      },
      {
        "x": 13,
        "y": 1,
        "layer": "terrain",
        "material": "campus_lawn",
        "role": "center",
        "reuse": "variant_tile",
        "source_reason": "base_terrain fill"
      },
      {
        "x": 14,
        "y": 1,
        "layer": "terrain",
        "material": "campus_lawn",
        "role": "center",
        "reuse": "variant_tile",
        "source_reason": "base_terrain fill"
      },
      {
        "x": 15,
        "y": 1,
        "layer": "terrain",
        "material": "campus_lawn",
        "role": "center",
        "reuse": "variant_tile",
        "source_reason": "base_terrain fill"
      },
      {
        "x": 0,
        "y": 2,
        "layer": "terrain",
        "material": "campus_lawn",
        "role": "center",
        "reuse": "variant_tile",
        "source_reason": "base_terrain fill"
      },
      {
        "x": 1,
        "y": 2,
        "layer": "terrain",
        "material": "campus_lawn",
        "role": "center",
        "reuse": "variant_tile",
        "source_reason": "base_terrain fill"
      },
      {
        "x": 2,
        "y": 2,
        "layer": "terrain",
        "material": "campus_lawn",
        "role": "center",
        "reuse": "variant_tile",
        "source_reason": "base_terrain fill"
      },
      {
        "x": 3,
        "y": 2,
        "layer": "terrain",
        "material": "campus_lawn",
        "role": "center",
        "reuse": "variant_tile",
        "source_reason": "base_terrain fill"
      },
      {
        "x": 4,
        "y": 2,
        "layer": "terrain",
        "material": "campus_lawn",
        "role": "center",
        "reuse": "variant_tile",
        "source_reason": "base_terrain fill"
      },
      {
        "x": 5,
        "y": 2,
        "layer": "terrain",
        "material": "campus_lawn",
        "role": "center",
        "reuse": "variant_tile",
        "source_reason": "base_terrain fill"
      },
      {
        "x": 6,
        "y": 2,
        "layer": "terrain",
        "material": "campus_lawn",
        "role": "center",
        "reuse": "variant_tile",
        "source_reason": "base_terrain fill"
      },
      {
        "x": 7,
        "y": 2,
        "layer": "terrain",
        "material": "campus_lawn",
        "role": "center",
        "reuse": "variant_tile",
        "source_reason": "base_terrain fill"
      },
      {
        "x": 8,
        "y": 2,
        "layer": "terrain",
        "material": "campus_lawn",
        "role": "center",
        "reuse": "variant_tile",
        "source_reason": "base_terrain fill"
      },
      {
        "x": 9,
        "y": 2,
        "layer": "terrain",
        "material": "campus_lawn",
        "role": "center",
        "reuse": "variant_tile",
        "source_reason": "base_terrain fill"
      },
      {
        "x": 10,
        "y": 2,
        "layer": "terrain",
        "material": "campus_lawn",
        "role": "center",
        "reuse": "variant_tile",
        "source_reason": "base_terrain fill"
      },
      {
        "x": 11,
        "y": 2,
        "layer": "terrain",
        "material": "campus_lawn",
        "role": "center",
        "reuse": "variant_tile",
        "source_reason": "base_terrain fill"
      },
      {
        "x": 12,
        "y": 2,
        "layer": "terrain",
        "material": "campus_lawn",
        "role": "center",
        "reuse": "variant_tile",
        "source_reason": "base_terrain fill"
      },
      {
        "x": 13,
        "y": 2,
        "layer": "terrain",